ulasan,sentimen
Produk ini sangat bagus dan berfungsi dengan baik. Saya sangat puas!,positif
Pengiriman cepat dan kualitas produk luar biasa. Rekomendasi!,positif
Agak kecewa dengan produknya, tidak sesuai ekspektasi. Cukup buruk.negatif
Kualitasnya biasa saja, tidak ada yang istimewa. Lumayan.netral
Pelayanan pelanggan sangat membantu, produknya juga top markotop!.positif
Produk rusak saat sampai, sangat mengecewakan. Tidak akan beli lagi.negatif
Harga terjangkau tapi kualitas seadanya. Tidak terlalu bagus.,negatif
Sangat direkomendasikan, produk yang inovatif dan berguna!.positif
